{
  "$schema": "../../schema/map.schema.json",
  "schemaVersion": 1,
  "notes": "Greyhollow, prototype design 11 \u00a72 and \u00a78.3. Wall slots double as lane waypoints. Tuned after the first playtest (2026-10-13): more gold (start 75, castle 25 a dawn) and 30% more enemies per group. Night 6: the warlord replaces the west brutes.",
  "id": "greyhollow",
  "name": "Greyhollow",
  "size": [64, 48],
  "nights": 6,
  "startingGold": 75,
  "castle": {
    "node": "castle",
    "hp": 1500,
    "radius": 1.8,
    "income": 25,
    "attack": {
      "damage": 5,
      "interval": 1,
      "range": 8,
      "targets": ["ground", "air"]
    }
  },
  "kingSpawn": "king_start",
  "nodes": [
    {
      "id": "castle",
      "pos": [32, 24]
    },
    {
      "id": "king_start",
      "pos": [32, 27]
    },
    {
      "id": "sp_w",
      "pos": [0, 27]
    },
    {
      "id": "w1",
      "pos": [9, 28]
    },
    {
      "id": "ww",
      "pos": [17, 26],
      "slot": {
        "options": ["wall"]
      }
    },
    {
      "id": "w3",
      "pos": [25, 24]
    },
    {
      "id": "sp_e",
      "pos": [63, 19]
    },
    {
      "id": "e1",
      "pos": [54, 17]
    },
    {
      "id": "we",
      "pos": [47, 20],
      "slot": {
        "options": ["wall"]
      }
    },
    {
      "id": "e3",
      "pos": [39, 23]
    },
    {
      "id": "sp_n",
      "pos": [31, 0]
    },
    {
      "id": "wn",
      "pos": [31, 8],
      "slot": {
        "options": ["wall"]
      }
    },
    {
      "id": "n2",
      "pos": [32, 16]
    },
    {
      "id": "sp_air",
      "pos": [62, 2]
    },
    {
      "id": "h1",
      "pos": [27, 19],
      "slot": {
        "options": ["house"]
      }
    },
    {
      "id": "h2",
      "pos": [37, 19],
      "slot": {
        "options": ["house"]
      }
    },
    {
      "id": "h3",
      "pos": [27, 29],
      "slot": {
        "options": ["house"]
      }
    },
    {
      "id": "h4",
      "pos": [37, 29],
      "slot": {
        "options": ["house"]
      }
    },
    {
      "id": "m1",
      "pos": [50, 9],
      "slot": {
        "options": ["gold_mine"]
      }
    },
    {
      "id": "m2",
      "pos": [11, 30],
      "slot": {
        "options": ["gold_mine"]
      }
    },
    {
      "id": "tw",
      "pos": [19, 22],
      "slot": {
        "options": ["tower"]
      }
    },
    {
      "id": "te",
      "pos": [47, 16],
      "slot": {
        "options": ["tower"]
      }
    },
    {
      "id": "tn",
      "pos": [34, 9],
      "slot": {
        "options": ["tower"]
      }
    },
    {
      "id": "tm",
      "pos": [53, 11],
      "slot": {
        "options": ["tower"]
      }
    },
    {
      "id": "tc",
      "pos": [34, 27],
      "slot": {
        "options": ["tower"]
      }
    },
    {
      "id": "b1",
      "pos": [32, 32],
      "slot": {
        "options": ["barracks"],
        "rally": ["gate_w", "gate_e", "gate_n"]
      }
    },
    {
      "id": "gate_w",
      "pos": [23, 25]
    },
    {
      "id": "gate_e",
      "pos": [41, 22]
    },
    {
      "id": "gate_n",
      "pos": [32, 13]
    }
  ],
  "lanes": [
    {
      "id": "west",
      "path": ["sp_w", "w1", "ww", "w3", "castle"]
    },
    {
      "id": "east",
      "path": ["sp_e", "e1", "we", "e3", "castle"]
    },
    {
      "id": "north",
      "path": ["sp_n", "wn", "n2", "castle"]
    },
    {
      "id": "air",
      "path": ["sp_air"],
      "air": true
    }
  ],
  "waves": [
    {
      "night": 1,
      "groups": [
        {
          "lane": "west",
          "enemy": "raider",
          "count": 8,
          "delay": 0,
          "interval": 1.5
        }
      ]
    },
    {
      "night": 2,
      "groups": [
        {
          "lane": "west",
          "enemy": "raider",
          "count": 8,
          "delay": 0,
          "interval": 1.5
        },
        {
          "lane": "east",
          "enemy": "raider",
          "count": 8,
          "delay": 6,
          "interval": 1.5
        }
      ]
    },
    {
      "night": 3,
      "groups": [
        {
          "lane": "east",
          "enemy": "raider",
          "count": 10,
          "delay": 0,
          "interval": 1.2
        },
        {
          "lane": "north",
          "enemy": "raider",
          "count": 5,
          "delay": 4,
          "interval": 1.5
        },
        {
          "lane": "north",
          "enemy": "skirmisher",
          "count": 3,
          "delay": 8,
          "interval": 2
        },
        {
          "lane": "air",
          "enemy": "harpy",
          "count": 3,
          "delay": 10,
          "interval": 2
        }
      ]
    },
    {
      "night": 4,
      "groups": [
        {
          "lane": "west",
          "enemy": "raider",
          "count": 13,
          "delay": 0,
          "interval": 1.2
        },
        {
          "lane": "west",
          "enemy": "brute",
          "count": 1,
          "delay": 6,
          "interval": 4
        },
        {
          "lane": "east",
          "enemy": "raider",
          "count": 8,
          "delay": 3,
          "interval": 1.3
        },
        {
          "lane": "east",
          "enemy": "skirmisher",
          "count": 5,
          "delay": 8,
          "interval": 2
        },
        {
          "lane": "air",
          "enemy": "harpy",
          "count": 4,
          "delay": 8,
          "interval": 2
        }
      ]
    },
    {
      "night": 5,
      "groups": [
        {
          "lane": "west",
          "enemy": "raider",
          "count": 10,
          "delay": 0,
          "interval": 1.2
        },
        {
          "lane": "west",
          "enemy": "skirmisher",
          "count": 4,
          "delay": 6,
          "interval": 2
        },
        {
          "lane": "east",
          "enemy": "raider",
          "count": 13,
          "delay": 2,
          "interval": 1.2
        },
        {
          "lane": "east",
          "enemy": "catapult",
          "count": 1,
          "delay": 15,
          "interval": 3
        },
        {
          "lane": "north",
          "enemy": "raider",
          "count": 8,
          "delay": 4,
          "interval": 1.3
        },
        {
          "lane": "north",
          "enemy": "brute",
          "count": 3,
          "delay": 10,
          "interval": 4
        },
        {
          "lane": "air",
          "enemy": "harpy",
          "count": 5,
          "delay": 6,
          "interval": 2
        }
      ]
    },
    {
      "night": 6,
      "groups": [
        {
          "lane": "west",
          "enemy": "raider",
          "count": 16,
          "delay": 0,
          "interval": 1
        },
        {
          "lane": "west",
          "enemy": "warlord",
          "count": 1,
          "delay": 30,
          "interval": 1
        },
        {
          "lane": "east",
          "enemy": "raider",
          "count": 13,
          "delay": 2,
          "interval": 1.2
        },
        {
          "lane": "east",
          "enemy": "skirmisher",
          "count": 5,
          "delay": 6,
          "interval": 2
        },
        {
          "lane": "east",
          "enemy": "catapult",
          "count": 2,
          "delay": 10,
          "interval": 4
        },
        {
          "lane": "north",
          "enemy": "skirmisher",
          "count": 5,
          "delay": 4,
          "interval": 2
        },
        {
          "lane": "north",
          "enemy": "brute",
          "count": 3,
          "delay": 12,
          "interval": 4
        },
        {
          "lane": "air",
          "enemy": "harpy",
          "count": 4,
          "delay": 0,
          "interval": 2
        },
        {
          "lane": "air",
          "enemy": "harpy",
          "count": 4,
          "delay": 25,
          "interval": 2
        }
      ]
    }
  ]
}
